{
  "id": "EXECUTAR-EDITORIAL",
  "version": "0.1.0",
  "mode": "mindmap",
  "nodes": [
    {
      "id": "e8627552-f0a7-4489-83e0-c6ab60565852",
      "kind": "root",
      "title": "LINHA DE PRODUÇÃO EDITORIAL: Programa EXECUTAR",
      "status": "READY",
      "owner": null,
      "evidence": [],
      "expanded": true,
      "description": null
    },
    {
      "id": "50cc7a5f-41b6-44bf-8954-0611e9f94c6c",
      "kind": "branch",
      "title": "FASE 01: ESTRATÉGIA",
      "status": "READY",
      "owner": null,
      "evidence": [],
      "expanded": true,
      "description": null
    },
    {
      "id": "a602c01a-ba41-4156-8782-3aaf37ce875b",
      "kind": "branch",
      "title": "Definir Pilar Estratégico",
      "status": "READY",
      "owner": null,
      "evidence": [],
      "expanded": true,
      "description": null
    },
    {
      "id": "3f988115-8e56-46c4-96a3-068fb79556b1",
      "kind": "task",
      "title": "Estabelecer diretriz temática",
      "status": "READY",
      "owner": null,
      "evidence": [],
      "expanded": true,
      "description": null
    },
    {
      "id": "1516a0b9-4618-40f6-a417-47c5c4f26c80",
      "kind": "task",
      "title": "Validar pilar estratégico (G01)",
      "status": "READY",
      "owner": null,
      "evidence": [],
      "expanded": true,
      "description": null
    },
    {
      "id": "619a6739-be4c-4939-8142-95e2fcde49ad",
      "kind": "branch",
      "title": "FASE 02: PESQUISA",
      "status": "READY",
      "owner": null,
      "evidence": [],
      "expanded": true,
      "description": null
    },
    {
      "id": "732383a8-dbd7-47c7-bbe3-6c12804f1885",
      "kind": "branch",
      "title": "Iniciar Campanha e Orquestrar Pesquisa",
      "status": "READY",
      "owner": null,
      "evidence": [],
      "expanded": true,
      "description": null
    },
    {
      "id": "3bc6a78b-39c1-4c47-a8ac-de92295101d1",
      "kind": "task",
      "title": "Acionar Trigger 1 (Leonardo)",
      "status": "BLOCKED",
      "owner": null,
      "evidence": [],
      "expanded": true,
      "description": null
    },
    {
      "id": "7bc1ba04-a3f0-40a3-8c41-5631e4246a8e",
      "kind": "task",
      "title": "Executar Wide Search (CLP)",
      "status": "READY",
      "owner": null,
      "evidence": [],
      "expanded": true,
      "description": null
    },
    {
      "id": "18e8e431-75b3-4713-8d0f-2240c2ebdb67",
      "kind": "branch",
      "title": "Gerar Mapa de Tópicos (DLV-0020)",
      "status": "READY",
      "owner": null,
      "evidence": [],
      "expanded": true,
      "description": null
    },
    {
      "id": "8ed2c28d-44af-471d-b099-a3b19a22f57e",
      "kind": "task",
      "title": "Estruturar dados e evidências em MD",
      "status": "BLOCKED",
      "owner": null,
      "evidence": [],
      "expanded": true,
      "description": null
    },
    {
      "id": "01236a03-1aab-457b-b2ea-e8ad86a13087",
      "kind": "branch",
      "title": "FASE 03: AUTORIA HUMANA",
      "status": "READY",
      "owner": null,
      "evidence": [],
      "expanded": true,
      "description": null
    },
    {
      "id": "5681754a-ee13-4924-b374-f229d4bac835",
      "kind": "branch",
      "title": "Criar Peça-Mãe e Derivados Iniciais",
      "status": "READY",
      "owner": null,
      "evidence": [],
      "expanded": true,
      "description": null
    },
    {
      "id": "a1fbc812-a62a-4b1f-8f20-f406785e4bd0",
      "kind": "task",
      "title": "Analisar pesquisa e escrever Peça-Mãe (DLV-0030)",
      "status": "BLOCKED",
      "owner": null,
      "evidence": [],
      "expanded": true,
      "description": null
    },
    {
      "id": "8decd915-75ba-4ce7-8f20-12ce8c685828",
      "kind": "task",
      "title": "Criar Storyboard (DLV-0040)",
      "status": "READY",
      "owner": null,
      "evidence": [],
      "expanded": true,
      "description": null
    },
    {
      "id": "34306fa0-49a3-4966-b289-61e292f7a799",
      "kind": "task",
      "title": "Extrair Quick Frameworks (DLV-0050)",
      "status": "READY",
      "owner": null,
      "evidence": [],
      "expanded": true,
      "description": null
    },
    {
      "id": "a35fabba-4665-4a25-8c31-73646a22918d",
      "kind": "task",
      "title": "Definir Assets e CTAs (DLV-0060)",
      "status": "READY",
      "owner": null,
      "evidence": [],
      "expanded": true,
      "description": null
    },
    {
      "id": "04ce5126-f680-4654-80bb-09ea1db4ee0f",
      "kind": "branch",
      "title": "Validar Pacote Autoral (G02)",
      "status": "READY",
      "owner": null,
      "evidence": [],
      "expanded": true,
      "description": null
    },
    {
      "id": "aeb1e874-2e7d-4c78-99d4-b7f2eb4a173f",
      "kind": "task",
      "title": "Verificar completude D2, D3, D4 e D5",
      "status": "BLOCKED",
      "owner": null,
      "evidence": [],
      "expanded": true,
      "description": null
    },
    {
      "id": "cd283e60-0ed7-4a9e-ba67-b5227ac336cc",
      "kind": "branch",
      "title": "FASE 04: CONVERSÃO AGENTIC",
      "status": "READY",
      "owner": null,
      "evidence": [],
      "expanded": true,
      "description": null
    },
    {
      "id": "cb670035-7a9c-4734-be00-8ac0000db617",
      "kind": "branch",
      "title": "Processamento e Rastreabilidade",
      "status": "READY",
      "owner": null,
      "evidence": [],
      "expanded": true,
      "description": null
    },
    {
      "id": "74ac7b01-ad39-465c-a98a-75ce68ba60d1",
      "kind": "task",
      "title": "Acionar Trigger 2 e Coletar Pacote",
      "status": "BLOCKED",
      "owner": null,
      "evidence": [],
      "expanded": true,
      "description": null
    },
    {
      "id": "ae7ada45-0215-4227-8028-bb50e50ef84c",
      "kind": "task",
      "title": "Executar Parallel Skills (PPS/Store/Editor)",
      "status": "READY",
      "owner": null,
      "evidence": [],
      "expanded": true,
      "description": null
    },
    {
      "id": "53ab4cfd-861c-41a4-a1c7-99880ca21f90",
      "kind": "task",
      "title": "Gerar CSV Operacional (DLV-0090)",
      "status": "READY",
      "owner": null,
      "evidence": [],
      "expanded": true,
      "description": null
    },
    {
      "id": "28aaabbc-4c16-403c-9bf4-5635ab8e3f79",
      "kind": "branch",
      "title": "Validar IDs e Rastreabilidade (G03)",
      "status": "READY",
      "owner": null,
      "evidence": [],
      "expanded": true,
      "description": null
    },
    {
      "id": "6f607a55-20c3-4a11-8cc2-94097c633e15",
      "kind": "task",
      "title": "Auditar integridade do CSV",
      "status": "BLOCKED",
      "owner": null,
      "evidence": [],
      "expanded": true,
      "description": null
    },
    {
      "id": "7124a709-4aa7-4a01-85d5-34ffce3baf24",
      "kind": "branch",
      "title": "FASE 05: PRODUÇÃO VISUAL",
      "status": "READY",
      "owner": null,
      "evidence": [],
      "expanded": true,
      "description": null
    },
    {
      "id": "b53b68bf-fb50-49da-a816-97cd66cc26ab",
      "kind": "branch",
      "title": "Geração de Assets Visuais",
      "status": "READY",
      "owner": null,
      "evidence": [],
      "expanded": true,
      "description": null
    },
    {
      "id": "6f0a944c-5071-4960-80b3-68464879cbfb",
      "kind": "task",
      "title": "Gerar Visual para cada Asset_ID",
      "status": "BLOCKED",
      "owner": null,
      "evidence": [],
      "expanded": true,
      "description": null
    },
    {
      "id": "69e51dc3-9f82-4208-ac27-913a8049e294",
      "kind": "task",
      "title": "Validar Visual (G04)",
      "status": "READY",
      "owner": null,
      "evidence": [],
      "expanded": true,
      "description": null
    },
    {
      "id": "18ac6510-6786-4cdd-bdcb-c4ff97d24bb5",
      "kind": "branch",
      "title": "Finalização de Assets",
      "status": "READY",
      "owner": null,
      "evidence": [],
      "expanded": true,
      "description": null
    },
    {
      "id": "29ce1009-0f0e-42f2-a6fb-75a96e789cdb",
      "kind": "task",
      "title": "Registrar e Upload de Asset Aprovado (DLV-0080)",
      "status": "BLOCKED",
      "owner": null,
      "evidence": [],
      "expanded": true,
      "description": null
    },
    {
      "id": "e60d294a-9923-4119-8775-b282b9cfb9ff",
      "kind": "task",
      "title": "Verificar conclusão de todos os assets (G05)",
      "status": "READY",
      "owner": null,
      "evidence": [],
      "expanded": true,
      "description": null
    },
    {
      "id": "fcd53674-ecb8-49c3-82c7-8275c01196cd",
      "kind": "branch",
      "title": "FASE 06: PRODUÇÃO AUDIOVISUAL",
      "status": "READY",
      "owner": null,
      "evidence": [],
      "expanded": true,
      "description": null
    },
    {
      "id": "e4569ff9-1eb2-4b37-aadd-fac92ace9811",
      "kind": "branch",
      "title": "Produção de Vídeo",
      "status": "READY",
      "owner": null,
      "evidence": [],
      "expanded": true,
      "description": null
    },
    {
      "id": "548466ed-e1f4-4688-bb89-9010ab8f6f50",
      "kind": "task",
      "title": "Preparar Produção de Vídeo",
      "status": "BLOCKED",
      "owner": null,
      "evidence": [],
      "expanded": true,
      "description": null
    },
    {
      "id": "84341b9e-bacf-4e04-8b66-4826bdbcf8a2",
      "kind": "task",
      "title": "Gerar Vídeo Master e Derivados",
      "status": "READY",
      "owner": null,
      "evidence": [],
      "expanded": true,
      "description": null
    },
    {
      "id": "c1698395-99f4-4bf0-a911-b9aeed6d3505",
      "kind": "branch",
      "title": "Consolidar Pacote de Produção (DLV-0101)",
      "status": "READY",
      "owner": null,
      "evidence": [],
      "expanded": true,
      "description": null
    },
    {
      "id": "b982c53c-89bc-4e70-8d66-365313068944",
      "kind": "task",
      "title": "Finalizar conjunto de peças IP-0101",
      "status": "BLOCKED",